final_score,alignment_rationale,effort_rationale,ticket_id,trace_id,description
9.0,"Improving scalability for large datasets is critical in enterprise security and governance. By ensuring that systems can efficiently handle increased data loads, organizations can maintain secure access controls and compliance with regulations as data grows. Additionally, a scalable solution often enhances reproducibility of processes and workflows, allowing for smooth transitions as data requirements evolve. While not directly related to user interface issues, focusing on the back-end infrastructure boosts overall system reliability and performance.","Improving scalability for large datasets typically requires significant architectural changes, including optimizing data storage, enhancing data retrieval mechanisms, and possibly integrating distributed systems. This may involve working with cloud services, implementing sharding, or redesigning databases, all of which can be complex and time-consuming.",25,tr-208976b652612da3620fba78ade4416a,Improve scalability for large datasets
8.0,"While gamification can enhance user engagement, it may not directly contribute to the strategic goals of enterprise security, governance, reproducibility, and flexible orchestration. The focus on engagement through gamification could divert resources from more critical areas, making it a lower priority.","Implementing gamification features involves designing and integrating systems like rewards, points, leaderboards, and achievements into the current user interface and backend. While the basic concepts are straightforward, the effort increases significantly with the need to ensure a seamless user experience, track user actions effectively, and analyze engagement metrics. Additionally, consideration for game mechanics that align with user motivations must be taken into account, making it moderately complex.",26,tr-3828566b3aee92c4558f595288c183ad,Add gamification features for user engagement
3.0,"Enhancing data visualization for model insights can improve understanding and communication of model performance and behavior, which indirectly supports enterprise security and governance through better decision-making. However, the direct impact on reproducibility and flexible orchestration is minimal, as this focus leans more towards presentation rather than the underlying processes that ensure security and reproducibility.","Enhancing data visualization for model insights involves integrating new visualization libraries and customizing existing visual components. While the task requires some technical skill and familiarity with data visualization tools, it is manageable within a standard development cycle. Challenges may arise in ensuring compatibility with existing data sources and maintaining clarity of insights, but overall, it strikes a balance between complexity and feasibility.",27,tr-0012503d274a7349e80537f251587dec,Enhance data visualization for model insights
4.5,"Incorporating voice recognition for model interaction adds a layer of interactivity and accessibility, which can enhance user experience. However, in terms of enterprise security and governance, it introduces potential risks such as unauthorized access and data privacy concerns. The implementation must ensure secure voice data handling and comply with regulations. While beneficial for usability, the focus on reproducibility and flexible orchestration would require additional considerations, thereby placing it in the middle of the alignment scale.","Implementing voice recognition for model interaction involves several challenges. It requires integrating a reliable speech-to-text API or library, handling variations in accents and noise levels, and ensuring accurate model interactions based on user input. Additionally, testing and refining the voice recognition accuracy for different use cases adds complexity. Overall, while not the hardest task, it requires substantial effort in both development and testing.",28,tr-e307d9642fed439134d70386a66e4386,Add voice recognition for model interaction
6.0,"Improving integration with ERP systems significantly enhances enterprise security and governance by ensuring that data flows securely between systems and complies with regulatory requirements. This integration facilitates reproducibility across business processes by maintaining consistent data handling and reporting. Additionally, it allows for more flexible orchestration of workflows, enabling organizations to adapt to changing business needs while ensuring data integrity and security.","Improving integration with ERP systems typically requires significant effort due to the complexity of the existing systems, the need for thorough understanding of both the current architecture and the desired enhancements. This process involves analyzing data flows, potentially rewriting interfaces, ensuring compliance with ERP data structures, and extensive testing to maintain system integrity. Additionally, it may require collaboration with multiple teams to align business needs with technical capabilities.",29,tr-3c5796461e73e1241d90ddf64cc8ca27,Improve integration with ERP systems
15.0,"While augmented reality features can enhance data visualization, aligning with enterprise security, governance, and reproducibility is not straightforward. The implementation of AR may introduce security vulnerabilities if personal or sensitive data is visualized improperly. Additionally, ensuring that AR solutions comply with governance frameworks and are reproducible in various environments can be challenging. However, the innovative potential of AR could facilitate insightful data analysis, meriting a moderate score.","Implementing augmented reality features for data visualization involves several complex elements. Firstly, it requires expertise in AR technologies and frameworks (like ARKit, ARCore, or Unity), which can have a steep learning curve. Secondly, integrating AR with existing data visualization systems necessitates both back-end and front-end modifications. Additionally, ensuring smooth and responsive AR experiences typically requires extensive testing across various devices. Lastly, scalability and user interface design for AR can further complicate the implementation, making it a moderately high effort task.",30,tr-111ba8ce8b3abbe77154356b13fde8e6,Add augmented reality features for data visualization
1.3333333333333333,"While enhancing mobile responsiveness improves user access and experience, it does not directly address core areas of enterprise security, governance, reproducibility, or flexible orchestration. This enhancement could indirectly support governance by facilitating mobile access to secure applications, but it lacks a strong alignment with strategic objectives.","Enhancing mobile responsiveness involves re-evaluating the current design and layout to ensure seamless functionality across various devices and screen sizes. This requires a moderate level of effort as it may involve adjusting CSS, implementing responsive frameworks, and testing across multiple platforms. While not the most complex task, it does require careful consideration to maintain user experience.",31,tr-8d0f7eee0a7c455acd21758863cbcb05,Enhance mobile responsiveness for platform access
2.6666666666666665,"Adding chatbot support primarily enhances user interaction and query handling, which may not directly address core enterprise security, governance, reproducibility, and orchestration concerns. While it can improve user experience, it does little to strengthen security protocols or governance frameworks essential for enterprise-level operations.","Implementing chatbot support involves several steps including selecting a suitable chatbot framework, designing conversation flows, integrating it with existing systems, and ensuring response accuracy. While there are many tools available to facilitate this process, it requires a fair amount of planning, testing, and user training to ensure effectiveness.",32,tr-e5c285b54595d60d51a86a3c9bc134a7,Add chatbot support for user queries
12.0,"Enhancing data import options for diverse formats significantly aligns with enterprise security and governance by ensuring that data integrity is maintained across various sources. This improvement supports reproducibility by allowing consistent and reliable data input, which is essential for operational stability. Additionally, flexible orchestration can be achieved by integrating these diverse formats into a cohesive workflow. However, while this is critical, the focus on UI papercuts is less relevant to the overarching strategy.","Improving data import options for diverse formats involves significant challenges. This task requires understanding and potentially working with multiple data formats (CSV, JSON, XML, etc.), which may have different schemas and validation rules. Additionally, developing a flexible and robust parsing system, ensuring compatibility, testing thoroughly across various formats, and handling edge cases can complicate the implementation process. While not the hardest task, it requires substantial effort and a good understanding of data integration principles.",33,tr-3ff69786395113f926965ea3d5b27841,Improve data import options for diverse formats
9.0,"While adding virtual reality support for immersive analytics can enhance user engagement and provide a novel way to visualize data, it primarily focuses on user experience rather than addressing core aspects of enterprise security, governance, reproducibility, or flexible orchestration. Virtual reality integration also adds complexities that could impact the governance framework and security protocols, making it less aligned with overall strategic objectives.","Implementing virtual reality support for immersive analytics is a complex task that involves not only the integration of VR hardware and software but also a significant overhaul of the current analytics user interface and experience. Developers must ensure compatibility with various VR platforms (like Oculus, HTC Vive, etc.), optimize performance for real-time rendering of data, and redesign the analytics workflows to fully utilize the capabilities of VR. Additionally, training and user experience testing will require substantial effort to ensure user adoption.",34,tr-0a02301af105c62e07baf475c849161a,Add virtual reality support for immersive analytics
3.0,"Enhancing email notifications for model updates improves communication and transparency, which is important for governance in enterprise security. However, while helpful, this enhancement does not directly address critical aspects like the security of the orchestration process or the reproducibility of model deployments. Therefore, it scores moderately for alignment in this strategic context.","Enhancing email notifications for model updates involves modifications to both the backend and frontend components. It requires understanding the current notification system and determining what enhancements are needed—such as improved formatting, additional content, or user preference options. While not overly complex, it does require thorough testing to ensure reliable delivery and performance across users, thus deserving a moderate rating.",35,tr-c5b552375b53f85011bc27b642addb8c,Enhance email notifications for model updates
6.0,"Integrating sentiment analysis for user feedback can enhance the understanding of user experiences and areas for improvement. However, the primary focus is on enterprise security and governance, which sentiment analysis may not directly impact. While it can inform flexibility in orchestration by highlighting user sentiment trends, it doesn't fundamentally alter the structural requirements of security or governance. Therefore, it rates a moderate alignment but falls short of strong strategic focus.","Implementing sentiment analysis involves integrating natural language processing (NLP) techniques, which can vary in complexity based on the required accuracy and the volume of data. Utilizing existing libraries (like NLTK or SpaCy) can simplify the process, but fine-tuning models for accurate sentiment scoring might increase effort. Additionally, setting up proper data pipelines for user feedback analysis and considering real-time processing can also add to the complexity.",36,tr-9a69c6941ff71523fd8e7191cf051bff,Add sentiment analysis for user feedback
20.0,"Improving data backup solutions for model data is crucial for ensuring enterprise security and data governance. Effective backup strategies not only protect against data loss but also enhance reproducibility by allowing data to be stored in a consistent and retrievable manner. However, while this aligns well with the goals of security and governance, the orchestration of backup processes may need to be further refined for maximum flexibility.","Improving data backup solutions for model data requires analyzing existing systems, understanding the specific needs of model data (such as frequency of backups, data integrity, and recovery options), and implementing technologies that may involve some complexity (like cloud solutions, automated backup scripts, or versioning systems). It also requires thorough testing to ensure data can be reliably restored, which adds to the effort.",37,tr-74fe37a4ef1f2c2daf22a5a44d10d944,Improve data backup solutions for model data
8.0,"Integrating IoT for real-time data significantly enhances operational intelligence, enabling improved security measures and governance through continuous monitoring of connected devices. This aligns well with the need for enterprise security by providing actionable insights and facilitating reproducibility in security protocols. However, the complexity of orchestration in IoT systems may pose challenges, thus a score of 4 reflects a strong alignment with a few caveats related to orchestration flexibility.","Integrating IoT for real-time data requires a solid understanding of IoT protocols, device management, data ingestion, and potentially scaling issues. It also involves ensuring reliable communication between devices and cloud/server infrastructure, managing security concerns, and possibly modifying the existing architecture to accommodate new data streams. This complexity makes it more challenging than simpler feature additions.",38,tr-ad255191c6b4769fdcb1e02e4cf13deb,Add IoT integration for real-time data
2.0,"Enhancing workflow automation for the model lifecycle significantly impacts enterprise security by standardizing processes and reducing the risk of human error. It strengthens governance through better tracking and compliance, which is critical in regulated industries. Additionally, reproducibility is improved, as automated workflows ensure consistent model training and deployment. However, the impact on flexible orchestration may vary based on the existing infrastructure and tools in use, warranting a score of 4 instead of 5.","Enhancing workflow automation for a model lifecycle involves integrating multiple components such as version control, deployment pipelines, and monitoring systems. This requires a thorough understanding of the current architecture and potential bottlenecks. Additionally, ensuring scalability and compatibility with existing systems can add complexity, making the effort moderately high.",39,tr-da79df1bef3aaa1d19b45cd4619e00a4,Enhance workflow automation for model lifecycle
12.5,"Facial recognition significantly enhances enterprise security by providing robust authentication mechanisms. It aligns well with governance by ensuring compliance with identity verification protocols, and it promotes reproducibility in securing access patterns. Furthermore, its integration into existing systems offers flexible orchestration capabilities, allowing for seamless adaptation across various platforms. Overall, it's a highly strategic improvement for enhancing security posture.","Implementing facial recognition requires integrating complex software and hardware components, ensuring high accuracy and speed under various lighting conditions, and handling privacy concerns and data protection regulations. Additionally, significant testing is necessary to ensure reliability and effectiveness in different environments.",40,tr-199a7917550b1df03653ddcf3c1ebfcd,Add facial recognition for security
8.0,"Improving cloud storage options for model data directly supports enterprise security and governance by ensuring that data is stored securely and can be easily managed and monitored. Enhanced storage options can also facilitate better reproducibility of experiments by providing reliable access to versioned datasets. Additionally, flexible orchestration can be achieved by integrating different cloud storage solutions, allowing for scalable data management practices, though the primary focus should remain on security and governance rather than UI improvement.","Improving cloud storage options for model data involves evaluating current storage solutions, identifying optimization areas, and possibly integrating new technologies or services. Tasks may include analyzing performance and cost, ensuring data security, and modifying how data is accessed and stored. While not the most complex task, it requires considerable technical understanding and might demand collaboration with other teams, making it moderately challenging.",41,tr-e7dc124d5aa5d91dda6e5a6929fa3804,Improve cloud storage options for model data
12.0,"Adding biometric authentication significantly enhances enterprise security by providing a robust layer of protection against unauthorized access. It aligns well with governance standards that necessitate strong access controls and can improve the reproducibility of secure access methods. Furthermore, biometric systems can be integrated into existing orchestration frameworks, allowing for flexible user authentication processes. However, considerations around user privacy, data storage, and potential implementation costs prevent a perfect score.","Implementing biometric authentication involves integrating hardware features (like fingerprint or facial recognition) with software for authentication. This requires thorough security considerations, compatibility testing with various devices, and potentially complex user interface changes. Additionally, ensuring compliance with data protection regulations adds to the implementation effort.",42,tr-56b0bb7cce48bf17873f33e113c968e2,Add biometric authentication for platform access
3.0,"While enhancing customer feedback tools aids in understanding user needs and can direct platform improvements, it may not significantly impact enterprise security, governance, or reproducibility. It does foster flexible orchestration by enabling more responsive adjustments but is less critical than foundational investments in security and governance. Therefore, it scores a 3 for its potential but not central role in strategic alignment.","Enhancing customer feedback tools involves several components such as selecting the right technology, integrating with existing systems, and potentially redesigning user interfaces to improve user experience. While not the most complex task, it requires thoughtful planning and coordination across multiple teams, making it moderately challenging.",43,tr-2ea4b935cd57f79e75f4dabdc041ce7b,Enhance customer feedback tools for platform improvement
4.5,"While adding video conferencing support enhances team collaboration and communication, it primarily addresses user experience and immediate collaboration needs rather than focusing on enterprise security, governance, reproducibility, or orchestration flexibility. Video conferencing solutions must be integrated securely with existing systems and comply with governance protocols, which can complicate deployment. Overall, this initiative has moderate alignment with the strategic focus criteria.","Implementing video conferencing support involves multiple components, including selecting a suitable SDK or API, integrating it into the existing system architecture, ensuring it works across various devices and browsers, and addressing potential security and privacy concerns. Additionally, thorough testing for performance and usability is required, making the effort more complex.",44,tr-9a31573facf0c3c1e2e98c3e9ff4faff,Add video conferencing support for team collaboration
11.25,"Improving data encryption for sensitive information directly enhances enterprise security by ensuring that data is protected at all stages, both at rest and in transit. This aligns strongly with governance standards by maintaining compliance with data protection regulations. Furthermore, effective encryption practices support reproducibility by providing assurance that sensitive data is consistently handled, while also allowing for flexible orchestration of encryption protocols in various environments, making the infrastructure adaptable to future security needs.","Improving data encryption for sensitive information involves evaluating current encryption methods, potentially integrating stronger algorithms or protocols, and ensuring compliance with security standards. This can be complex due to the need for backward compatibility, potential system downtime, and thorough testing to avoid data loss or corruption.",45,tr-affebf16e36340ec1e85a61c929fd6aa,Improve data encryption for sensitive information
6.0,"While AI-powered chatbots can enhance user support by providing quick responses and streamlining customer service, they may not significantly impact core areas such as enterprise security, governance, and reproducibility. Their integration could pose challenges in data handling and compliance with security protocols. Moreover, the effective orchestration of AI interactions would require robust backend systems to ensure accountability and consistency.","Implementing AI-powered chatbots for user support requires significant effort in several areas including design, integration, and training of the AI models. The chatbot must be tailored to understand user queries and provide accurate, context-aware responses. Additionally, it involves backend integration with existing systems, ensuring data privacy and security, and iterating based on user feedback. While there are existing frameworks and APIs available, customizing the solution to fit specific user needs is complex and time-consuming.",46,tr-bc4a49458b77888c239098550f947938,Add AI-powered chatbots for user support
3.75,"Enhancing project management features for AI projects can contribute to better organization and tracking, which is essential for maintaining governance and reproducibility in enterprise settings. However, this enhancement may not directly address core security issues or flexible orchestration, thus limiting its strategic impact on overall enterprise security and governance.","Enhancing project management features for AI projects involves integrating complex functionalities that support AI-specific workflows, such as data management, model tracking, and collaboration tools. This requires a thorough understanding of both project management principles and AI development processes. Additionally, the implementation could involve significant changes to existing systems, testing, and ensuring compatibility with multiple tools, making it a moderately high-effort task.",47,tr-e65c9f68cec3281df5303c7bb3ba1535,Enhance project management features for AI projects
4.0,"Adding custom reporting tools for enterprise analytics aligns well with the strategic focus on enterprise security and governance by enabling organizations to tailor reports that comply with their regulatory needs. Additionally, custom reporting enhances reproducibility by allowing users to generate consistent reports based on predefined criteria. However, the flexibility in orchestration is less direct, as it primarily depends on how these tools integrate with existing systems and workflows. Overall, the initiative provides significant value but may require careful integration into the overall architecture.","Implementing custom reporting tools for enterprise analytics involves several complexities. It requires a deep understanding of the existing data architecture, integration with multiple data sources, and the ability to manipulate and visualize data effectively. Additionally, ensuring scalability, security, and meeting the varying needs of different stakeholders can make this a challenging task. Customizing reports to cater to various user requirements and ensuring user-friendly interfaces adds further to the complexity.",48,tr-4acf94cf91aa48502c917f6ad2a861f2,Add custom reporting tools for enterprise analytics
6.0,"While improving API documentation is essential for developer support, it primarily affects user experience rather than addressing core issues of enterprise security, governance, reproducibility, and flexible orchestration. Enhancing documentation may indirectly assist in better governance (through clearer guidelines) but does not align strongly with strategic priorities in security and orchestration.","Improving API documentation typically involves organizing existing content better, adding examples, and clarifying language. This process is generally straightforward, requiring basic writing and organizational skills, and can be done incrementally. While it requires attention to detail and understanding of the API, it does not involve complex programming or major system changes, making it a moderate effort task.",49,tr-60d9fa6baa0e4a13eb56630d6a2ecfda,Improve API documentation for developer support
