final_score,alignment_rationale,effort_rationale,ticket_id,trace_id,description
6.0,"Adding support for multi-model deployment enhances the flexibility and scalability of the product. It allows organizations to implement diverse machine learning models concurrently, improving their ability to respond to varied business needs and scenarios. This aligns with enterprise security and governance by enabling better resource management and compliance adherence across different models. However, the implementation complexity and potential for increased orchestration challenges slightly reduce the score, as careful management will be required to maintain reproducibility and secure deployments.","Adding support for multi-model deployment requires significant architectural changes to ensure that the system can handle multiple models simultaneously. This involves revising the deployment pipeline, updating the serving infrastructure, managing resource allocation for each model, and ensuring they can operate independently while maintaining performance and reliability. Furthermore, it may require extensive testing to ensure compatibility and stability across different environments.",1,tr-e1a08bbc84976b61a18f23c70c05bb20,Add support for multi-model deployment
12.0,"Enhancing model evaluation metrics is crucial for ensuring robust enterprise security and governance. Improved metrics can provide more accurate insights into model performance and reliability, which directly impacts decision-making and compliance in an enterprise context. While this initiative primarily focuses on model performance, its implications for reproducibility and flexible orchestration are significant, as clearer metrics facilitate better understanding and integration of models across diverse workflows.","Enhancing model evaluation metrics involves refining existing metrics or developing new ones to better assess model performance. This requires a good understanding of the current evaluation processes, statistical methods, and potentially extensive testing to validate the new metrics. It may also involve integrating these enhanced metrics into the existing evaluation framework, thus requiring moderate effort in coding, testing, and possibly updating documentation.",2,tr-92563a31e6f55f5c8a0c5c3be3353c0f,Enhance model evaluation metrics
5.0,"Implementing real-time monitoring dashboards significantly enhances enterprise security by providing immediate visibility into system performance and potential security threats. This aligns well with governance as it ensures compliance and accountability through accurate tracking of activities. Additionally, reproducibility is supported by enabling standardized monitoring metrics across the organization. However, while the core functionalities are strong, the implementation may necessitate careful orchestration to maintain flexibility in adapting to changing monitoring needs without over-complications.","Implementing real-time monitoring dashboards requires integrating various data sources, ensuring data accuracy, and providing a user-friendly interface. The complexity increases with the need for real-time data processing, scalability, and potential security concerns. Additionally, depending on the technology stack and the level of customization required, the effort can vary significantly. Overall, it's moderately complex and requires a solid understanding of both frontend and backend technologies.",3,tr-fd5fe24f9aa5da1b7bcabc8884030157,Implement real-time monitoring dashboards
8.0,"Integrating with existing CI/CD pipelines enhances security and governance by ensuring that all code passes through established security checks and quality gates before deployment. This fosters reproducibility by maintaining consistent build environments and tooling throughout the development lifecycle. Additionally, flexible orchestration can be achieved as CI/CD pipelines can be tailored to automate security measures at various stages, balancing speed with compliance. However, the effectiveness of this integration largely depends on the current infrastructure and practices, which may not fully align with enterprise needs in some cases.","Integrating with existing CI/CD pipelines can be complex due to the need for thorough understanding of the current environment, tooling, and processes. This involves identifying integration points, ensuring compatibility with current tools, and possibly modifying existing configurations, which can be error-prone. Additionally, coordination with multiple teams may be required to align on deployment practices and to minimize disruptions during the integration.",4,tr-8721ab028312d66f8d12c371ee19a147,Integrate with existing CI/CD pipelines
4.0,"Automated model retraining significantly enhances the adaptability and reliability of machine learning systems, which aligns well with enterprise security and governance by ensuring models remain effective and accurate over time. This process also promotes reproducibility by enabling consistent updates and evaluations of model performance. Furthermore, automated retraining can be orchestrated flexibly to accommodate various data pipelines and operational needs, thus enhancing overall system resilience. However, while crucial, it does not directly address UI issues, hence not a perfect score.","Adding automated model retraining involves several steps such as data pipeline development, model evaluation criteria setup, scheduling mechanisms, and monitoring systems. It requires a good understanding of the existing model architecture, data sources, and integration with CI/CD processes. Implementing these features is complex and requires careful planning and testing to ensure reliability and performance.",5,tr-325cc4e25ba705c022aa8641e3e88e85,Add automated model retraining
5.0,"Federated learning supports decentralized data processing, which enhances enterprise security by keeping sensitive data local and reducing exposure. This approach aligns well with governance requirements as it can help manage compliance with data protection regulations. Additionally, it promotes reproducibility in model training, enabling organizations to validate and replicate results across different nodes. However, the orchestration of federated learning models can be complex, requiring robust frameworks to ensure flexibility and efficiency, which is why it does not receive a perfect score.","Implementing federated learning requires a complex integration of distributed systems, data privacy measures, and coordination among multiple clients. The architecture must support secure data exchange and model updates without centralizing sensitive data, which adds complexity. Additionally, managing heterogeneous device capabilities and maintaining model consistency across different clients further escalates the implementation efforts.",6,tr-9e392118b8b247df1232b98a8d73563f,Support for federated learning
6.0,"Expanding the API for custom model integration significantly enhances the flexibility and adaptability of the enterprise platform, allowing for improved orchestration of various models. This aligns well with the goals of reproducibility and governance as it enables users to integrate and deploy models securely and consistently. However, the focus should remain on ensuring strong security practices while expanding functionality, which can be challenging.","Expanding an API for custom model integration involves modifying existing endpoints or adding new ones to accommodate new functionality. This requires a thorough understanding of the current API structure, potential impacts on existing systems, and the complexities of integrating varying model types. Additionally, ensuring robust documentation, backward compatibility, and security mechanisms increases the implementation effort significantly.",7,tr-e8dbdd6924db0d971c00e99fa6982a3c,Expand API for custom model integration
4.0,"Optimizing resource allocation for model training significantly enhances enterprise security and governance by ensuring that resources are efficiently utilized, thus minimizing waste and potential vulnerabilities. Additionally, it supports reproducibility, as well-allocated resources can ensure that models are trained uniformly and iteratively. Flexible orchestration also benefits from optimized resource allocation, allowing for dynamic scaling and adjustments based on workload and performance metrics.","Optimizing resource allocation for model training involves analyzing various factors such as hardware specifications, data input/output rates, and training schedules. It requires understanding the dependencies between resources and workloads, implementing load balancing, and potentially re-architecting parts of the infrastructure. Additionally, it may involve testing different strategies to find the most efficient allocation, which can be complex and time-consuming.",8,tr-8336a541b4ed78a2b7723d6f4eabe69c,Optimize resource allocation for model training
16.0,"Implementing user role-based access control (RBAC) significantly enhances enterprise security by ensuring that only authorized individuals can access sensitive information and perform critical tasks. It aligns well with governance frameworks that require strict access policies and accountability. RBAC improves reproducibility by standardizing permissions across user roles and allows for flexible orchestration by enabling dynamic adjustments to access levels as organizational needs change. While it may introduce some complexity in user management, the overall benefits for security and governance are substantial.","Implementing user role-based access control involves designing and integrating a system that manages user roles, permissions, and access levels. This includes defining roles, implementing a permission matrix, updating the existing authentication system, and ensuring security measures to prevent unauthorized access. The complexity can increase based on existing architecture, the number of roles needed, and the granularity of access required.",9,tr-0ce95f0562cd6da2fdf623aaece784b3,Add user role-based access control
9.0,"Enhancing data versioning capabilities significantly improves enterprise security by ensuring that data integrity is maintained and previous versions can be audited or restored as necessary. It also supports governance by providing clear trails of data changes and decisions. Additionally, effective data versioning aids in reproducibility, allowing for accurate replication of data states for analysis or regulatory purposes. While flexible orchestration can also benefit indirectly, the primary focus is on enhancing data management and security.","Enhancing data versioning capabilities involves significant changes to the existing architecture, requiring updates to data storage mechanisms, creation of version management protocols, and ensuring backwards compatibility. Additionally, it may necessitate a comprehensive audit of all existing data models and could involve complex migration strategies. The complexity and potential for introducing new bugs make this a challenging task.",10,tr-d1e5f22d3ecad1edcb8728d1a8876c1a,Enhance data versioning capabilities
7.5,"Supporting hybrid cloud deployments is crucial for enterprise security and governance as it allows organizations to maintain control over sensitive data while leveraging the flexibility and scalability of the cloud. This alignment enhances reproducibility in processes across different environments and enables more flexible orchestration of resources, ensuring consistent security measures and compliance across both on-premises and cloud infrastructures.","Implementing support for hybrid cloud deployments requires careful consideration of various components such as network architecture, data synchronization, security protocols, and compliance measures. Additionally, ensuring seamless integration between on-premises and cloud resources can be complex and may require significant changes to existing infrastructure. This effort typically involves collaboration between multiple teams and systems, making it more challenging than straightforward implementations.",11,tr-98929822ce5d800c27e371f86b7fac3f,Support for hybrid cloud deployments
2.0,"While enhancing collaboration tools for data scientists can significantly improve their productivity and teamwork, the focus on enterprise security, governance, reproducibility, and flexible orchestration is moderate. Collaboration tools must also ensure secure data handling and compliance with governance policies, which is crucial for enterprise-level applications. However, without addressing the core areas of security and governance, the collaboration improvements might lead to potential risks in data management. Therefore, a score of 3 reflects an intermediate level of alignment with strategic priorities.","Improving collaboration tools for data scientists involves assessing current tools, gathering user feedback, and implementing enhancements. This requires a mix of technical and user experience design skills, but existing frameworks and tools available in the market can streamline the process. The effort is moderate due to the need for integration with existing workflows and potentially diverse requirements from data scientists.",12,tr-d5c435b022adfde261ae929db39777a9,Improve collaboration tools for data scientists
20.0,"Integrating blockchain-based data integrity aligns well with enterprise security by enhancing trust and transparency in data management practices. This approach supports governance frameworks through immutable records and traceability, ensuring that data cannot be tampered with after it is recorded. Additionally, it aids in reproducibility, as all data transactions can be verified without inconsistencies. Although it may introduce complexities in orchestration due to the decentralized nature of blockchain technology, its benefits significantly enhance overall data governance and security in the enterprise landscape.","Implementing blockchain-based data integrity involves several complexities, including understanding blockchain technology, selecting the right blockchain platform, designing a secure architecture, and ensuring seamless integration with existing systems. Additionally, considerations for consensus mechanisms, transaction costs, and compliance with legal frameworks add to the effort required.",13,tr-876ba8facee26ae62ec699ef87e6a9c4,Add blockchain-based data integrity
8.0,"Enhancing model interpretability features significantly aligns with enterprise security and governance by allowing stakeholders to understand model decisions, ensuring transparency and compliance with regulations. Improved interpretability also aids in reproducibility, as it clarifies how models arrive at specific outcomes, which is crucial for audits and validation. While this initiative may not directly impact orchestration, it supports overall strategic goals by improving trust in AI systems.","Enhancing model interpretability features involves improving how users understand model decisions, which can require integrating new techniques, possibly revising existing frameworks, and ensuring compatibility with various model types. While it can be complex and may require some research and experimentation, it is manageable within a standard project timeline.",14,tr-1c69e9a2bd089296f9e27e4eb633ee14,Enhance model interpretability features
2.0,"Implementing automated hyperparameter tuning greatly enhances reproducibility and governance in machine learning workflows. It allows for systematic exploration of the hyperparameter space, leading to more robust model performance and reducing the likelihood of overfitting. It integrates well with flexible orchestration tools, enabling seamless automated pipeline execution. However, while it significantly contributes to enterprise security through controlled experimentation, the initial implementation needs careful attention to prevent security vulnerabilities in automated systems.","Automating hyperparameter tuning involves selecting the right optimization technique (e.g., grid search, random search, Bayesian optimization) and integrating it into the existing model training pipeline. This requires a solid understanding of both the machine learning model being utilized and the specific tuning methods to balance efficiency and effectiveness. Additionally, depending on the framework and data size, managing computational resources and tuning parameters can significantly increase complexity, making it a moderately difficult task.",15,tr-0679eb182bd4f2832922944da369102a,Implement automated hyperparameter tuning
8.0,"Adding support for edge AI deployments significantly enhances enterprise security by processing data close to its source, thereby reducing latency and exposure to potential breaches during data transmission. This aligns well with governance as it allows for real-time compliance monitoring and data control. Moreover, it supports reproducibility through consistent deployment of AI models across edge devices. While it does offer some flexibility in orchestration, the complexity of managing distributed deployments can pose challenges, preventing a perfect score.","Implementing support for edge AI deployments involves several complexities. This includes optimizing AI models for low-latency execution on resource-constrained devices, ensuring security and privacy of data at the edge, integrating with various hardware and software environments, and possibly developing new deployment pipelines. Additionally, extensive testing is required to verify performance and reliability across diverse edge scenarios, making it a moderately difficult task.",16,tr-29f9ead6a1efc346139edc2bbb45d951,Add support for edge AI deployments
6.0,"While improving UI/UX can enhance user satisfaction and efficiency, it is not the primary focus for strategic alignment in enterprise security, governance, reproducibility, and flexible orchestration. These elements are more critical for long-term success and risk management in model management, making UI improvements a lower priority.","Improving UI/UX for model management involves a moderate level of effort. It requires understanding user needs, conducting usability testing, redesigning interfaces, and implementing changes. The process includes collaboration with designers and developers, and may involve backend adjustments to support new features. While it doesn't require fundamental architectural changes, it does need a thoughtful approach to enhance user experience.",17,tr-8363d5937355fe6763d8caca7f763d0f,Improve UI/UX for model management
6.0,"While real-time collaboration features can enhance teamwork and communication, they do not directly address core strategic priorities such as enterprise security, governance, reproducibility, and flexible orchestration. Enhancing these areas should take precedence to ensure a robust framework before adding collaborative functionalities.","Implementing real-time collaboration features requires a robust infrastructure to support simultaneous data changes, handling conflicts, and ensuring data consistency across users. This involves integrating WebSocket or similar technologies for real-time communication, which can increase complexity. Additionally, the need for user notifications, presence indicators, and possibly a backend overhaul to manage state synchronization across clients adds to the implementation effort.",18,tr-ce40f1d9688ab8524945643267d3d1b5,Add real-time collaboration features
3.75,"Enhancing data privacy and compliance tools is crucial for ensuring that enterprise security measures are in place, especially in a landscape of increasing regulations and data breaches. Strong data privacy frameworks not only protect sensitive information but also improve governance by ensuring that organizations adhere to legal standards. This enhancement also facilitates better reproducibility of compliance audits and reports, ensuring that businesses can consistently meet requirements. Furthermore, implementing flexible orchestration capabilities can streamline compliance processes across multiple environments, optimizing both operational efficiency and security posture.","Enhancing data privacy and compliance tools requires a deep understanding of both legal regulations and technical capabilities. This involves assessing existing systems, identifying gaps for compliance with laws such as GDPR or HIPAA, and potentially overhauling data handling procedures, which can be complex and time-consuming. It also requires additional security measures and thorough testing to ensure that enhancements do not disrupt current services.",19,tr-03afef0211ea6629dc870098eeed719b,Enhance data privacy and compliance tools
5.0,"While custom branding can enhance user experience and offer a tailored approach for enterprise clients, it does not significantly impact essential areas like security, governance, and orchestration. It focuses more on aesthetic adjustments, which are less critical compared to foundational elements. Therefore, it aligns poorly with the strategic priorities of enterprise security and robust governance.","Implementing custom branding for enterprise clients involves multiple components such as user interface design, backend modifications to handle different configurations for each client, and thorough testing to ensure all branding elements integrate seamlessly. Additionally, this effort may require coordination with marketing for brand assets and compliance with client specifications, which can complicate the process.",20,tr-66ba40478776a1741c5163af780d865a,Add custom branding for enterprise clients
4.5,"Integrating with popular data annotation tools can enhance the ecosystem but primarily focuses on user-facing functionalities rather than the core aspects of enterprise security, governance, and reproducibility. While it supports flexibility in workflows, it might not significantly impact strategic goals related to robust governance and security frameworks.","Integrating with popular data annotation tools involves understanding diverse APIs, handling various data formats, and ensuring that the integration is seamless across multiple platforms. The complexity increases with the need for user authentication, potential rate limiting, and maintaining data integrity during transfer. Additionally, the requirement for a responsive user interface to facilitate interaction with these tools adds to the development effort.",21,tr-a80502b65437f23516930c00de055351,Integrate with popular data annotation tools
6.0,"Adding an offline mode for model evaluation can enhance security and governance by allowing sensitive data to be processed without relying on cloud infrastructures. This aligns with reproducibility as it enables consistent evaluation in controlled environments. However, the degree of orchestration flexibility in offline settings may be limited compared to cloud solutions, influencing the overall strategic alignment score.","Implementing an offline mode for model evaluation involves several components: designing a local data access layer, ensuring models can run without reliance on online resources, managing data synchronization, and possibly extending existing infrastructure to handle local storage and computations securely. This requires a solid understanding of the current evaluation process as well as significant modifications to both software architecture and user interface, which makes it complex.",22,tr-0807928254f46fa9ee2fdb8cd294df0f,Add offline mode for model evaluation
5.0,"While enhancing search functionality for datasets can improve user experience and data discovery, it primarily focuses on user interface and accessibility rather than the core aspects of enterprise security, governance, reproducibility, and flexible orchestration. This enhancement may indirectly support these areas by enabling better data management, but it does not directly address strategic alignment with the specified priorities.","Enhancing search functionality for datasets involves improving indexing, query optimization, and possibly adding features like filters or faceting. While it requires a solid understanding of the existing architecture and may involve some backend changes, the complexity is moderate because it's mainly about refinements rather than a complete overhaul.",23,tr-861eaa6f7dd1ed138bfb6ba9ebc02bbc,Enhance search functionality for datasets
4.0,"Adding predictive analytics for model performance significantly enhances enterprise security and governance by enabling proactive monitoring of model behavior and potential vulnerabilities. This aligns with the goal of reproducibility, as it allows for the tracking and validation of model outputs over time. Furthermore, predictive analytics can inform flexible orchestration, as it provides insights into model performance that can lead to optimized resource allocation and workflow adjustments. However, the integration requires careful consideration of data quality and governance, preventing a perfect score.","Implementing predictive analytics for model performance involves several steps such as data collection, model selection, feature engineering, and validation techniques. Additionally, integrating new analytics into existing systems can require significant architectural changes and thorough testing to ensure reliability and accuracy. While not the most complex endeavor, it requires a solid understanding of both the analytics domain and the existing model architecture, making it a moderately high effort overall.",24,tr-aa97ee435ed94b25ed4fe71b5956c9f4,Add predictive analytics for model performance
